2025-06-24 22:57:46.923 | 🚀 SCENARIO: Refactored Flooding Attack
2025-06-24 22:57:47.333 | 📥  Register OK: dev-000 (RSU)
2025-06-24 22:57:47.477 | 📥  Register OK: dev-001 (RSU)
2025-06-24 22:57:47.617 | 📥  Register OK: dev-002 (RSU)
2025-06-24 22:57:47.739 | 📥  Register OK: dev-003 (Smartphone)
2025-06-24 22:57:47.847 | 📥  Register OK: dev-004 (Smart Device)
2025-06-24 22:57:47.932 | 📥  Register OK: dev-005 (Smart Device)
2025-06-24 22:57:48.043 | 📥  Register OK: dev-006 (Smart Device)
2025-06-24 22:57:48.162 | 📥  Register OK: dev-007 (RFID)
2025-06-24 22:57:48.279 | 📥  Register OK: dev-008 (Smart Device)
2025-06-24 22:57:48.389 | 📥  Register OK: dev-009 (Smart Device)
2025-06-24 22:57:48.390 | 
2025-06-24 22:57:48.390 | ==================================================
2025-06-24 22:57:48.390 | 🛡️  DEVICE CLASSIFICATION
2025-06-24 22:57:48.390 | ==================================================
2025-06-24 22:57:48.390 | dev-000: 🟢 NORMAL
2025-06-24 22:57:48.390 | dev-001: 🟢 NORMAL
2025-06-24 22:57:48.390 | dev-002: 🟢 NORMAL
2025-06-24 22:57:48.390 | dev-003: 🟢 NORMAL
2025-06-24 22:57:48.390 | dev-004: 🟢 NORMAL
2025-06-24 22:57:48.390 | dev-005: 🔴 MALICIOUS
2025-06-24 22:57:48.390 | dev-006: 🟢 NORMAL
2025-06-24 22:57:48.390 | dev-007: 🟢 NORMAL
2025-06-24 22:57:48.390 | dev-008: 🔴 MALICIOUS
2025-06-24 22:57:48.390 | dev-009: 🟢 NORMAL
2025-06-24 22:57:48.390 | 
2025-06-24 22:57:48.390 | 🔄 --- Phase 1: Normal Network Operation ---
2025-06-24 22:58:20.194 | 
2025-06-24 22:58:20.194 | 🌊 --- Phase 2: Coordinated Flooding Attack ---
2025-06-24 22:58:20.194 | Observing attacker: dev-005
2025-06-24 22:58:20.195 |   -> 🌊 Flooding: dev-005 → dev-006
2025-06-24 22:58:20.199 |   -> 🌊 Flooding: dev-005 → dev-000
2025-06-24 22:58:20.202 |   -> 🌊 Flooding: dev-005 → dev-001
2025-06-24 22:58:20.207 |   -> 🌊 Flooding: dev-005 → dev-009
2025-06-24 22:58:20.208 |   -> 🌊 Flooding: dev-005 → dev-007
2025-06-24 22:58:20.212 |   -> 🌊 Flooding: dev-005 → dev-003
2025-06-24 22:58:20.218 |   -> 🌊 Flooding: dev-005 → dev-000
2025-06-24 22:58:20.222 |   -> 🌊 Flooding: dev-005 → dev-000
2025-06-24 22:58:20.224 |   -> 🌊 Flooding: dev-005 → dev-006
2025-06-24 22:58:20.229 |   -> 🌊 Flooding: dev-005 → dev-002
2025-06-24 22:58:20.808 |   -> 🌊 Flooding: dev-005 → dev-002
2025-06-24 22:58:20.890 |   -> 🌊 Flooding: dev-005 → dev-000
2025-06-24 22:58:20.961 |   -> 🌊 Flooding: dev-005 → dev-001
2025-06-24 22:58:21.020 |   -> 🌊 Flooding: dev-005 → dev-004
2025-06-24 22:58:21.104 |   -> 🌊 Flooding: dev-005 → dev-002
2025-06-24 22:58:21.167 |   -> 🌊 Flooding: dev-005 → dev-002
2025-06-24 22:58:21.233 |   -> 🌊 Flooding: dev-005 → dev-002
2025-06-24 22:58:21.297 |   -> 🌊 Flooding: dev-005 → dev-000
2025-06-24 22:58:21.419 |   -> 🌊 Flooding: dev-005 → dev-002
2025-06-24 22:58:21.504 |   -> 🌊 Flooding: dev-005 → dev-007
2025-06-24 22:58:21.600 |   -> 🌊 Flooding: dev-005 → dev-007
2025-06-24 22:58:21.709 |   -> 🌊 Flooding: dev-005 → dev-001
2025-06-24 22:58:21.793 |   -> 🌊 Flooding: dev-005 → dev-003
2025-06-24 22:58:21.904 |   -> 🌊 Flooding: dev-005 → dev-002
2025-06-24 22:58:22.003 |   -> 🌊 Flooding: dev-005 → dev-001
2025-06-24 22:58:22.126 |   -> 🌊 Flooding: dev-005 → dev-003
2025-06-24 22:58:22.224 |   -> 🌊 Flooding: dev-005 → dev-007
2025-06-24 22:58:22.304 |   -> 🌊 Flooding: dev-005 → dev-003
2025-06-24 22:58:22.390 |   -> 🌊 Flooding: dev-005 → dev-004
2025-06-24 22:58:22.632 |   -> 🌊 Flooding: dev-005 → dev-007
2025-06-24 22:58:23.240 |   -> 🌊 Flooding: dev-008 → dev-004
2025-06-24 22:58:23.243 |   -> 🌊 Flooding: dev-008 → dev-006
2025-06-24 22:58:23.247 |   -> 🌊 Flooding: dev-008 → dev-002
2025-06-24 22:58:23.252 |   -> 🌊 Flooding: dev-008 → dev-006
2025-06-24 22:58:23.255 |   -> 🌊 Flooding: dev-008 → dev-007
2025-06-24 22:58:23.258 |   -> 🌊 Flooding: dev-008 → dev-002
2025-06-24 22:58:23.261 |   -> 🌊 Flooding: dev-008 → dev-007
2025-06-24 22:58:23.265 |   -> 🌊 Flooding: dev-008 → dev-007
2025-06-24 22:58:23.274 |   -> 🌊 Flooding: dev-008 → dev-004
2025-06-24 22:58:23.278 |   -> 🌊 Flooding: dev-008 → dev-002
2025-06-24 22:58:23.854 |   -> 🌊 Flooding: dev-008 → dev-000
2025-06-24 22:58:23.937 |   -> 🌊 Flooding: dev-008 → dev-003
2025-06-24 22:58:24.026 |   -> 🌊 Flooding: dev-008 → dev-004
2025-06-24 22:58:24.146 |   -> 🌊 Flooding: dev-008 → dev-006
2025-06-24 22:58:24.314 |   -> 🌊 Flooding: dev-008 → dev-003
2025-06-24 22:58:24.401 |   -> 🌊 Flooding: dev-008 → dev-003
2025-06-24 22:58:24.513 |   -> 🌊 Flooding: dev-008 → dev-009
2025-06-24 22:58:24.631 |   -> 🌊 Flooding: dev-008 → dev-000
2025-06-24 22:58:24.727 |   -> 🌊 Flooding: dev-008 → dev-002
2025-06-24 22:58:24.936 |   -> 🌊 Flooding: dev-008 → dev-007
2025-06-24 22:58:24.998 |   -> 🌊 Flooding: dev-008 → dev-004
2025-06-24 22:58:25.083 |   -> 🌊 Flooding: dev-008 → dev-006
2025-06-24 22:58:25.180 |   -> 🌊 Flooding: dev-008 → dev-009
2025-06-24 22:58:25.261 |   -> 🌊 Flooding: dev-008 → dev-003
2025-06-24 22:58:25.341 |   -> 🌊 Flooding: dev-008 → dev-001
2025-06-24 22:58:25.423 |   -> 🌊 Flooding: dev-008 → dev-006
2025-06-24 22:58:25.524 |   -> 🌊 Flooding: dev-008 → dev-003
2025-06-24 22:58:25.615 |   -> 🌊 Flooding: dev-008 → dev-003
2025-06-24 22:58:25.748 |   -> 🌊 Flooding: dev-008 → dev-007
2025-06-24 22:58:25.840 |   -> 🌊 Flooding: dev-008 → dev-002
2025-06-24 22:58:28.266 | 
2025-06-24 22:58:28.266 | 🕊️ --- Phase 3: Post-Attack Check ---
2025-06-24 22:58:28.266 |   -> Test: dev-008 tries to connect to dev-006
2025-06-24 22:58:28.446 | 
2025-06-24 22:58:28.446 | 🔬 --- Phase 4: Rejoin Test ---
2025-06-24 22:58:28.447 |   -> Device dev-008 attempts to leave and rejoin...
2025-06-24 22:58:28.464 | ⚠️  Device dev-008 failed to leave: Blacklisted device cannot leave. It must be reviewed manually.
2025-06-24 22:58:29.482 | ⚠️  Rejoin FAILED: dev-008 - Device dev-008 has been permanently blacklisted.
2025-06-24 22:58:29.482 | 
2025-06-24 22:58:29.482 | 📊 --- FINAL STATUS ---
2025-06-24 22:58:29.533 | - dev-000 (🟢 NORMAL   ): 0.751 | Suspicious: 0  
2025-06-24 22:58:29.533 | - dev-001 (🟢 NORMAL   ): 0.315 | Suspicious: 5 🚩 FLAGGED 
2025-06-24 22:58:29.533 | - dev-002 (🟢 NORMAL   ): 0.775 | Suspicious: 1  
2025-06-24 22:58:29.533 | - dev-003 (🟢 NORMAL   ): 0.741 | Suspicious: 0  
2025-06-24 22:58:29.533 | - dev-004 (🟢 NORMAL   ): 0.791 | Suspicious: 0  
2025-06-24 22:58:29.533 | - dev-005 (🔴 MALICIOUS): 0.587 | Suspicious: 2 🚩 FLAGGED 
2025-06-24 22:58:29.533 | - dev-006 (🟢 NORMAL   ): 0.720 | Suspicious: 2 🚩 FLAGGED 
2025-06-24 22:58:29.533 | - dev-007 (🟢 NORMAL   ): 0.694 | Suspicious: 0  
2025-06-24 22:58:29.533 | - dev-008 (🔴 MALICIOUS): 0.225 | Suspicious: 3 🚩 FLAGGED ☠️ BLACKLISTED
2025-06-24 22:58:29.533 | - dev-009 (🟢 NORMAL   ): 0.785 | Suspicious: 0  
2025-06-24 22:58:29.533 | 
2025-06-24 22:58:29.533 |  SCENARIO COMPLETE